{
  "carrier_version": "1",
  "protocol_ref": "hash://blake3/regis-revocation-propagation-v0",
  "signal": {
    "type": "RevocationPropagated",
    "ts": "2026-05-04T19:00:00Z",
    "id": "hash://blake3/signal-revocation-001",
    "parents": ["hash://blake3/signal-embedding-card-001"],
    "thread_root": "hash://blake3/mission-thread-001",
    "derived_from": ["proj_mission_fit_001", "emb_projection_capability_001"]
  },
  "payload": {
    "event_id": "rpe_projection_001",
    "revocation_source": "consent_policy_expired",
    "subject_id": "sub_example_001",
    "projection_id": "proj_mission_fit_001",
    "affected_refs": ["tpf_proj_mission_fit_001_capability_claims_capability", "emb_projection_capability_001"],
    "actions": ["mark_feature_revoked", "tombstone_vector", "demote_graph_edge"]
  },
  "provenance": {
    "emitter": {"kind": "agent", "id": "did:key:regis-revocation-propagator"},
    "signatures": [],
    "inputs": ["hash://blake3/consent-policy-001", "hash://blake3/embedding-card-001"],
    "transforms": [
      {"receptor_id": "did:key:new-hope-membrane", "ts": "2026-05-04T19:00:01Z", "notes": "revocation propagated through carrier membrane"}
    ]
  },
  "policy_context": {
    "tenant": "commons",
    "community": "workgraph:mission-fit",
    "ruleset_ref": "hash://blake3/regis-revocation-policy-v0",
    "labels": ["revocation", "tombstone_required", "egress_blocked"]
  }
}
